<<?xml version="1.0" encoding="UTF-8" standalone="yes"?>

<datoscoche xsi:noNamespaceSchemaLocation="practica09_UD7.xsd" xmlns:xsi="http://www.w3.org/2001/XMLSchema-instance">
	<remesa>
		<numcoches>100</numcoches>
		<marca>Toyota LandCruiser</marca>
		<color>gris</color>
		<puertas>3</puertas>
		<paisproductor>Japon</paisproductor>
		<paiscomprador>Espa√±a</paiscomprador>
		<nombrebarco>SeaAdventurer</nombrebarco>
	</remesa>
</datoscoche>
